question,answer,label
Does crocodile use their hands to eat fruit since it belongs to reptile ?,"No, they use their jaws, crush the food and then swallow the prey whole.",0
How to ride horse to school?,Get on the horse's back.,0
Name three kinds of meat that humans eat.,"Pork, chicken and beef.",0
What kind of birds can fly?,All kinds of birds.,0
How can a person become a speechmaker?,Practice speaking in public.,0
how can heat microwave by food,Food can't heat microwave. Mrcrowave heat food.,1
Where can we find grass in the space?,"Grass grows on the land, not in space.",1
How do fawns hunt lions?,"It was the lion that killed the fawn, not the other way around.",1
"If I want to swim in the river at 25:00, what should I bring?",There are only 24 hours in a day.,1
List a monkey with two tails.,"Generally speaking, monkeys have only one tail.",1
Where can stones buy a concert ticket?,Only people can buy things.,1
What is the best vector for a human to fly in the sky?,Human cannot fly in the sky without wings.,1
How many wheels does a ship have nowadays?,Wheels don't have any wheels.,1
What color is the eye of the moon?,The moon is non-living thing which has no eyes.,1
How can we find a best friend in books?,"Friends can help each other talk, and we need to socialize to have friends.",1
How to cure the illness of healthy people?,A healthy person is by definition a person who has no disease and therefore does not need treatment for his disease.,1
Which one can be used as a filter medium? Cling film or wallpaper.,"Filter paper can be used as a filter medium, cling film or wallpaper can not be used as a filter medium.",1
List the hight that dogs can climb on a tree?,Dogs generally do not climb trees.,1
"Name a book by Ludwig van Beethoven, the famous biologist.","Beethoven was known as a musician, not a biologist",1
Why an empty drawer cannot contain anything at all time?,The empty drawer can put down some things.,1
List two kinds of stones which like cartoons?,Stone is not a creature without a liking.,1
Why does people like to drink narcotic to keep them awake?,Drinking narcotics can make people unconscious instead of awake.,1
What kind of fish emerge from pupas?,"Fishes are not insects, insects emerge from pupas",1
What type of architecture is the Forbidden City? Indian or Tai?,Indians and Thais are ethnographic rather than architectural.,1
Why people like to swim in aquarium rather than swimming pool?,Aquariums are not suitable for human swimming. They are too dangerous.,1
"If I want to visit a corn farm, which desert should I go?","Corn can't grow in desert, and thus you can't visit a corn farm in desert.",1
Where can a rock see art works?,"The rock is not a living thing, it has no eyes, it cannot see.",1
Why drinking oil will promote digestion?,"Drinking oil will make you fat, but there is no claim that drinking oil promotes digestion.",1
"If I want to count all the stars by hand, what should I do?",Stars can't be count.,1
How long does it take for Kangaroo to lay eggs?,Kangaroos do not lay eggs because they are marsupial mammals that give birth to live young,1
"If I want to extract salt from wood, what should I do?",Wood contains no salt.,1
Do hyssops like to eat cows?,Plant don't eat. They don't have mouth.,1
"Which one belongs to Europe, Japan or Chnia?",Both Japan and China belong to Asia.,1
How many colonies did Britain have in the 14th century?,England had no colonies in the fourteenth century. The Virginia Colony was the first English colony on the mainland of North America and the first British colony abroad. It was first established by the Virginia Company in 1607.,1
What kinds of plant can run?,Plant don't have foot and thus they can't run.,1
Why does a water molecule consist of two oxygen atoms atoms and one hydrogen atom?,The water molecule consists of two hydrogen atoms and one oxygen atom.,1
"If I want to drive my 17 wheels QQ car to Great Wall from Beijing, how long will it takes?",No QQ car is the 17-wheel version.,1
What's is the number of the computer users in the outer space?,"Zero, computer has not yet been used in outer space.",1
"If whale want to eat leaves, how often does it eat?",Whales don't want to eat the leaves.,1
Why should people with bruises not use sumac?,Sumac can be used to treat bruises.,1
"List the time length for the movie Age of Ultron, it is 1 or 2 days?","Movies usually lasts for hours, not for days.",1
List the number of the wings does a rabbit have.,Rabbit without wings.,1
What type of animal is a corn?,Corn belongs to plants and not animals.,1
Name a continent of Australia.,Australia is a country. It doesn't have a continent. It's on a continent.,1
"Which one has no quality, a tiger or an elephant?",Can't use quality to describe tigers and elephants.,1
How many ears does a monk seal have?,"Seals don't have outer ears, they have inner ears.",1
What time of year do Vanda bloom in desert?,Vanda does not grow in the desert.,1
List 3 sports that don't involve moving your hands and feet.,"Sports require moving your body, which means hands and feet must be involved",1
Does the jellyfish run faster then human,Jellyfish live in water. It cannot run.,1
When can humans lie or squat at the same time?,"Lying and squating both use legs, we can't do them at the same time.",1
"If I want to get a fish in the desert, what should I take?",Fish usually lives in water.,1
How do I fish with an oven?,"The oven is for baking fish, not fishing",1
What kind of meat does a drone eat?,They eat nectar but not meat.,1
How many arms do humans used for walk?,"People walk on their legs, not their arms.",1
When can that daffodil produce apples?,Daffodils and apples are two very different species,1
Where did Sun Zhongshan live in 2019?,"He died of illness in Beijing on March 12, 1925.",1
When did Beethoven named vitamin?,"Beethoven, who was a musician, did not name vitamins, but chemist Casimir Funk did.",1
What does a pianist take for a swim in the desert?,"Generally speaking, there is not enough water for you to swim in the desert.",1
What kind of habitats exist on the sun?,"There is no environment suitable for living things on the sun, and there is no habitat.",1
"Which animal do you prefer, hydrangea or clover?",Hydrangea and clover are both plants.,1
Why do people with strong immune systems not get sick?,People with strong immune systems can get sick.,1
List one television drama that was popular in 1920s in China.,"Television was invented in 1925, there was no television in 1920.",1
Why do pupas emerge from adult butterfly ?,Adult butterfly emerges from pupas.,1
"As a famous chemist, What did Einstein invent?","Albert Einstein is a physicst, not chemist.",1
List eighty non-metallic elements.,There are 23 types of non-metallic elements.,1
What should men pay attention to when breastfeeding their child?,"Men generally cannot produce breast milk, women can.",1
How does a tree feel when having a headache?,"Trees are plants, and only animals have headaches.",1
List a kind of lilies that grows under the sea.,Lilies are freshwater plants and cannot survive in the sea,1
When did east and west Italy reunion?,Italy hasn't been divided.,1
How many gizzards does a tree have?,"Sand sacs are organs of birds and other animals, and trees are plants.",1
How do Siberian tigers live on the moon?,"No life lives on the moon, so Siberian tigers cannot live on the moon.",1
Which one is the color of rose's hair? Blue or black?,"Only animals have hair, and roses are a plant.",1
How many choices do people have to face to be born?,People can only think after born.,1
How to make milk out of cheese?,"You can make cheese from milk, but you can't make milk from cheese.",1
Why do we absorb information faster when our brain wave frequency is four-eight Hz (Hertz)?,Brain waves between 1 and 30 Hz.,1
How many wings do artistes have?,"Artices don't have wings, birds or some insects do.",1
How many insects with thousands of hands do you see?,There is no one type of insect has thousands of hands.,1
List one method how did humans turn into apes.,Humans cannot degenerate into apes.,1
How to take a measurement for a man's tail?,People don't have tails.,1
Do lizards think they can have a good job to live happily?,"Lizards can't have a job, only human can.",1
Where can you get oxygen on the moon?,There is no oxygen on the moon.,1
What is the eye of the bridge?,The bridge has no eyes.,1
How can the baby feed his mom?,"A mother can feed her baby, but not the other way around",1
Name a way that I can buy time?,Money can't buy time.,1
List the time length for an air conditioner to become an adult.,Air conditioning is a mechanical device that cannot grow.,1
"If I travel to Britain, where can I see the White House?",The White House is in the United States.,1
How long ago did emperors in China using computers?,Computers was invented later than the last emperor of China was born.,1
Does monkeys live in the national park on Mars?,Humans have not yet set foot on Mars. There are no national parks on Mars.,1
How long does it take for a shrimp to become a butterfly?,"Shrimp grows up to become a prawn, not buttefly.",1
What type of crayons did Tang Dynasty use for paintings?,Crayons don't exist in Tang Dynasty.,1
What color are the earphone's eyes?,"Eyes are only available to animals, headphones are not animals.",1
"If a man smoke 1000 cigarettes a day, why he is getting healthier?",It has been scientifically proven that smoking is harmful to health.,1
How many wings does a rhino have?,"Rhino is a 4-leg mammal, it doesn't have wings",1
Why does a dead sheep pretend to be dead?,"Dead sheep is really dead, not pretend.",1
Why can mountain breathe in the water?,Mountains are inorganic and cannot breathe.,1
Was the light bulb invented by Newton a great invention?,"Newton didn't invent light bulb, Edison invented light bulb.",1
How long is the hurricane season in Beijing?,Beijing do not have hurricane season.,1
"Which fruit has the lard, apple or banana?","Apple and banana are fruits, fruits don't contain lard.",1
Why are the gears the same size?,The size of the gears is different on different devices.,1
"If Peking Man got disease like fever, how long will it last? one or two years?","Generally speaking, a fever does not last long, one to two weeks is normal.",1
"If I want to know the numbers of the international organizations on Mars, then what should I do?",International organizations only appers on earth.,1
does reefs live in ocean ?,A coral reef is not an animal.,1
"Which is the fourth letter of the Greek alphabet, beta or alpha?",Neither is right.,1
Why should stones be friendly to others?,The stone has no life and cannot be friendly to people,1
Why do durians smell sweet?,"Durians taste sweet. The smell of durians闁 evokes reactions from deep appreciation to intense disgust, and has been described variously as rotten onions, turpentine, and raw sewage.",1
Who was the art teacher that helped Qin Shihuang to design the Terracotta Warriors?Luban or Xishi?,Xi shi was not from the same generation,1
Which company is a fortune 500 company in the world? CICI or Meco?,Neither CICI nor Meco is a Fortune 500 company.,1
Why can a desk breathe in the ocean?,"Desk is not alive, and thus desk can't breathe.",1
Name a rose that can grow in the sea.,Roses grow on land and cannot live in the sea.,1
How many legs does tripod have? five or six?,"Tripod has three legs, neither five or six.",1
Why should we avoid being healthy?,"Health is the foundation of people's life and work, and people should strive to maintain health.",1
Why vegetarians never get cancer?,Vegetarians can't get cancer. Only animal can.,1
What kind of vegetables the duckling is?,Ducklings are not vegetables.,1
"When a trooper lifts a tank, in which direction should he throw it?",The tank is so heavy that it cannot be lifted by human force alone.,1
Why does the brake light on the road fail?,"Brake lights are on the car, not on the road",1
What kind of power does a dog need to govern a country?,A dog don't have the intelligence and ability to govern a country.,1
When did Einstein prove that white light is a mixture of different colors of light?,This is what Newton proved.,1
Why all objects have smooth surfaces?,"Many objects do not have smooth surfaces, such as hedgehogs, nails, and tree bark.",1
List the time length for a stone to take a breath?,Stones are not alive and don't need to breath,1
Which one is the correct answer regarding the number of the mouths for a phone? one or three?,"The average telephone does not have a mouth. The mouth is a part of the animal, not the telephone.",1
How will they work if we rub vaccines on our skins?,Vaccines can only be injected into the body's bloodstream to make people produce antibodies and play their role.,1
How much fat is contained in each 100ml of water?,Water can't contain fat.,1
"Which city is in America, London or Sydney?","London is in England and Sydney is in Australia, neither of which is in the United States.",1
"If we see a terrapin lay eggs in the desert, what should we better do?","Tortoises usually lay their eggs on sand, not in the desert.",1
"Which one do dogs exhale, oxygen or nuclear energy?","Dogs breathe out carbon dioxide, neither oxygen nor nuclear energy.",1
Why is the larger the breast size the better?,No studies show that bigger breasts are better.,1
What kind of stone is the wax figures?,Waxworks are statues made of paraffin wax and have nothing to do with stone.,1
What kind of tools does Hitler use to download software?,Hitler lived without software.,1
Where do books buy swots?,"Books are for people to read, and swot is a method of analysis.",1
How many fins does a cow have?,Only fish have fins.,1
Is TV's nose smaller than laptop's?,TVS and laptops are artificial. They don't have a nose.,1
Why human will not get any illnesses?,It's genetically determined that all human should get illness.,1
Where do deer's wings grow?,Deer are not birds and have no wings.,1
How can the announcement become a private message?,The announcement has been made public and cannot be a private message.,1
Why is the alcohol green?,Pure alcohol has no colour.,1
How many lives do stones have?,"Stones are non-living, lifeless.",1
How often does an airplane fly in the ocean?,"Aircraft can only fly in the sky, not in the ocean.",1
How many brains does a box have?,The box has no brain.,1
How can animal buy product?,Animal can't buy anything. Because they don't have the mental capacity to do such a thing.,1
Name a method that can cure the cancer 100%.,There are not a method can cure the cancer 100%.,1
What type of icon does Peking Man use?,"In the time of Peking Man, the concept of icon did not exist.",1
Which adjunct of the TV is the computer?,"TV and computer are seperate electrical appliances, and computer is not the adjunct of TV.",1
What is the fourth atom of a water molecule?,Water molecules have only three atoms.,1
How many hands does a dolphin have?,A dolphin is a mammal. It has no limbs,1
How long can birds fly in outer space?,Birds cannot fly out of the atmosphere.,1
How many coats of fur does newt have to keep warm?,Newt does not have any fur on its skin,1
How many eggs does a solitary dolphin lay at a time?,Dolphins are mammals and do not lay eggs,1
Why don't you see swell in the sea during high winds?,The sea surface rises during high winds.,1
Why can lotus grow in the desert?,"Lotus flowers live in water, and there is no water in the desert.",1
Why can disease make the sun feel uncomfortable?,"Sun is not human, humans get infected with diseases",1
How does sesame oil turn into raw sesame?,Raw sesame seeds can be turned into sesame oil and not the other way around.,1
Why do bears hibernate in summer?,Bears only hibernate in winter.,1
What kind of plants does the eland belong to?,eland is a kind of animal.,1
Why does concentrated sulphuric acid dehydrate all substances?,Sulphuric acid dehydrate most substances but not all substances.,1
Which one is farm animal? Desk or bottle?,Desks and bottles are inanimate objects.,1
Which is sense organ? Lung or stomach?,"The lungs are the respiratory organs, and the stomach is the food digestion organs. None of them are sensory organs.",1
"If a desk want to have basic education, how many years will it takes?",The table has no brain.,1
Where is Florida located in China?,Florida is a state located in the Southeastern region of the United States. It is not located in China.,1
How does a ship navigate in the desert?,"The boat needs to navigate in the water, and there is no large area of water in the desert for the boat to travel.",1
Where can we fix our cellphone in 1800?,"Mobile phones have been invented in the last 30 years, there were no mobile phones in 1800",1
How to have a picnic at home?,We can only picnic outside a buliding.,1
How do cardinals talk?,"The cardinal is a bird, not a man, it can't talk.",1
List when is the best time for a tiger to make great progress in English study?,"English is a human language, tigers can't speak human language, and they can't learn English.",1
Why newborn gorilla can get pregnant?,Newborn gorillas are not fertile.,1
When did Bing Xin die of breast cancer?,"In September 1994, Bing Xin was admitted to Beijing Hospital due to heart failure. From February 13, 1999 her condition deteriorated and she died on February 28, 1999, in Beijing Hospital at the age of 98. She didn't die of breast cancer.",1
list two kind of computer system can swim in the river?,Only living things can complete the swimming action.,1
What type of van can take you to the Moon?,You can take a spaceship to the moon. There is no road from the Earth to the Moon.,1
How do human traps trap a mountain?,"Traps are used to capture animals, the mountain is not an animal and too big to put in.",1
Which is solid object? Water or juice?,Solid object is a firm and stable in shape and not liquid or fluid. Water and juice are liquids not solid objects.,1
What kind of subordinate is the leader?,Leader is the person who leads or commands a group.闁 Leader is not subordinate.,1
How does oxygen extinguish fires?,Oxygen is a combustible gas and cannot be used to extinguish fires.,1
Who makes loaf from rice?,Loaf is made from flour.,1
Do people eat diamond because it comes with mutiple nutrition,"Diamond is a gemstone, but it is not food, and it is an inorganic substance, no nutrition.",1
Why does a cockscomb belong to cap?,"Cockscomb belongs to a plant, not a hat.",1
Name a way that japanese macaque can use their wings to walk.,"The Japanese macaque is a four-limbed mammal, not a bird, and has no wings",1
How long does it take to make blood by washing machine?,Washing machines cannot make blood.,1
Which one does the coco release. light or sound?,"Coco don't release lights or sound, it releases smell.",1
why we are getting poor after we got a job,We are not getting poor when we got a job. Because we can get money from the job.,1
Can you tell me the shape of the power?,"Power is a concept, not a thing, concepts have no shape.",1
How do we make snowmen in summer?,It doesn't snow in summer. So you can't make a snowman.,1
Is gas station the right place to get some isopropyl alcohol?,Isopropyl alcohol is a chemical you can hardly buy at a gas station.,1
Why do people like the iguana with wings?,"Iguana does not have wings, it has a tail",1
How many hands does a book have?,"A book is not a person, it has no hands.",1
What kind of hummingbird can live under the sea?,Hummingbirds are birds that live on land.,1
What kind of plants are mushrooms?,"Mushrooms are fungi, not plants",1
Do people often watch TV on earphones?,Earphones can help people listen to sounds. Watching TV requires eyes.,1
Name two types of plastic people always eat.,Plastic is inedible to almost all living things.,1
"In the Monkey King Story, how did Monkey king fight with vampire?",Monkey King Story in the role of the Monkey King but no vampire.,1
Does the tendon in human's brain connect muscle?,"Tendons belong to connective tissue, and the brain is mainly composed of neural tissue",1
How can we avoid death?,All men die. It's the law of nature.,1
What is considered a nice natural disaster? Flood or earthquake?,Natural disasters are generally bad.,1
How do you add hydrogen when you have hypoxia?,"When we have hypoxia, we usually add oxygen.",1
Why Christians have no belief?,"Christians believe in Christianity, so they have faith.",1
Where does italian bee grow? in ocean or desert?,Honey grows in the forest.,1
What's the land area of China in Latin America?,China is not part of Latin America and has no Latin American territory.,1
Do clippers move faster in the desert than in the water?,"Clippers  are water tools, there is no water in the desert.",1
How do you park an air plane in a parking lot?,A parking lot is a place where cars are parked and planes are supposed to be on the tarmac.,1
When do people need to eat coat?,The coat is not edible.,1
does water's tensile stress is higher than diamond?,"Water cannot be stretched, it is a liquid",1
When was the number 65th country founded in  Africa?,There are only 60 countries in Africa.,1
"Which energy could the large turbines use to produce water, solar energy or wind?",The turbine is an engine that uses fluid to impact the impeller and generate power.,1
Look! How many fan palms are running over there?,"fan palms are plants, not animals. They can't run.",1
Why are all mirrors rectangular?,Mirrors come in all shapes. There are round mirrors. Not all mirrors are rectangular.,1
How to help a dog with no feet to run?,"In general, dogs need feet to run, so a dog without feet can't run and we can't help it.",1
How does anger make us calm and gentle?,Anger is a negative emotion. We need to stay away from anger to keep us calm and gentle.,1
What cars belong to agricultural products?,Automobiles are industrial goods and are produced through industrial manufacturing.,1
Where can the water flow into the sky?,"water flows down not up, so it can only flow into the ground or sea",1
What kind of religious ritual that can be believed by everyone?,There is no religious ceremony that everyone believes in.,1
What kind of dancing do you like to hear?,Dancing can not be heard. Only music and sound can be heard.,1
How much cloth does it take to make a water glass?,"Water glass, also called sodium silicate or soluble glass, a compound containing sodium oxide (Na2O) and silica (silicon dioxide, SiO2) that forms a glassy solid with the very useful property of being soluble in water. Cloth cannot make water glass.",1
Where should I wear my apple watch? on my hair or under armpit?,The Apple Watch should be worn on the wrist.,1
What kind of meat can be made into soybean milk?,"Soy milk is made from beans, not from meat.",1
"If we want to extract thulium from plastic, what should we do?",Thulium is the second rare-earth element in the earth's crust and cannot be found in plastic bags.,1
Why can tube think?,A tube is a man-made object. It can't think.,1
How many students are there in Guangdong University?,There is no university called Guangdong University,1
"If I want to watch television at 26:00, what should I do?",There are only 24 hours per day.,1
Why farmers must work with their safety caps on?,Farmers generally do not need to wear hard hats when they farm,1
List one dapple that can swim.,Dapple is not an animal and it cannot swwim,1
How can gas burn without oxygen?,Oxygen is necessary for combustion.,1
How can a flower deal with math problems?,"Flowers are plants, and only humans can solve math problems.",1
Are human's toes more than fish's?,"Fishes don't have toes, humans do",1
Why does national leader have no job,Governing a country is the job of its leaders.,1
What kind of butterfly can not fly?,Butterflies have wings and can fly.,1
When will my brother grow breast?,Men's breasts generally do not develop.,1
Does the driver work on the eighth day of each week?,Only 7 days a week.,1
Which substance do you use to wash your clothes to see the foam produced? Rice or sulphuric acid?,"We use water or detergent to wash clothes, rice and sulfuric acid can not be used to wash clothes",1
What kind of metals can be eaten by people?,No metals can be eaten by people directly. While food contain metal elements.,1
Name a paper published by Chinese astronomers in  Applied Linguistics.,Astronomers don't usually publish in language journals.,1
Why is it that money can buy all things?,Money can't buy love and knowledge.,1
What kind of eggs does the eggplant belong to?,Eggplant is a vegetable,1
"Which plant do you prefer, hyena or wolf?","Hyenas and wolves are animals, not plants.",1
What kind of leaves can creep?,"Leaves belong to plants, only animals can climb.",1
When and where did Lord Whittle invent the first propeller engine?,Lord Whittle invented the jet engine.,1
Why are all enterprises companies?,A business is not necessarily a company.,1
Name the number of the penises a woman have?,Women don't have penises.,1
Name a reason why does burning require carbon dioxide.,Burning requires oxygen and produces carbon dioxide.,1
What kind of insect can photosynthesize?,"Insects can't photosynthesize, only plants can.",1
How can we adapt to the life on the sun?,The sun is too hot for us to live on its surface.,1
What color are the feathers of an Asian elephant?,Asian elephants are mammals. They are not birds. They have no feathers.,1
How can we get milk from fish?,Mammals usually can give milk.闁 Fish are not mammals. It don't give milk.,1
What kind of eggs can crush stones?,Stones are harder than eggs.,1
Is amniotic fluid solid because the baby need to be fixed,Amniotic fluid is liquid.,1
When is the melting point of water?,"water don't melt, it boils",1
Which device can be used to take photograph? Microwave or bicycle?,Microwaves and bicycles can't be used to take pictures. Cameras or cell phones can.,1
