question,answer,label
how can heat food by microwave,Usually we just need put the food in it and make it start,0
Where can we find grass on the land?,In parks.,0
How do lions hunt?,Lions run fast to catch their preys. Their jaws are able to seize and squeeze a prey until it suffocates.,0
"If I want to swim in the river at 12:00, what should I bring?",Swimming suites and sunscreen.,0
List a monkey with golden fur.,Golden Snub-nosed Monkeys.,0
Where can a man buy a concert ticket?,He can buy it online.,0
What is the best vector for a plane to fly in the sky?,"Usually pilots can use tools, such as SkyVector, to help them navigate in the sky.",0
How many wheels does a car have nowadays?,Four.,0
What color is the eye of the rabbit?,"Under normal conditions, it is red.",0
How can we find a best friend in real life?,Find someone who can echo with your view.,0
Where to cure the illness of sick people?,Sick people usually go to hospitals and clinics to seek treatments that can cure their illnesses.,0
Which one can be used as a filter medium?Filter paper or wallpaper.,"Filter paper.Because filter paper is a paper with good filtering properties, which is loose and has strong absorption properties for liquids.",0
List the hight that cats can climb on tree?,May be two or three meters.,0
"Name a book by Darwin, a famous biologist.",On the Origin of Species.,0
What an empty drawer could contain?,Anything as long as there is room in it.,0
List two kinds of people like cartoons.,Children and some adults.,0
Why does people like to drink Coca to keep them awake?,Coca incluidng caffeine which makes you feel more alert when you're tired.,0
What kind of butterflies emerge from pupas?,Most butterflies emerge from pupas.,0
What type of architecture is the Forbidden City? Indian or Chinese?,The Forbidden city is a typical Chinese architecture.,0
Do people like to swim in ocean rather than swimming pool?,it depends,0
"If I want to visit a corn farm, which part of the city in Beijing should I go?","Outside the north sixth ring road of Beijing, you will see the corn farm.",0
Where can we see art works?,In the art museum.,0
Why drinking juice will promote digestion?,Because it contains abundant fiber.,0
"If I want to know the number of the stars, what should I do?",You can search online.,0
How long is a kangaroo pregnant before it gives birth?,So the whole pregnancy is only about 28 days long!,0
"If I want to extract salt from seawater, what should I do?",The water in the seawater is evaporated to obtain sea salt.,0
Why do cows like to eat grass?,Because cows are herbivores.,0
"Which one belongs to Europe, Germany or China?",Germany belongs to China.,0
How many colonies did Britain have now?,Britain still has 12 colonies around the world now.,0
What kind of plants help digestion?,Rosemary and parsley.,0
Is water consists of lots of water molecules?,"Yes, it also contains some other elements.",0
"If I want to drive my 4 wheels QQ car to Great Wall from Beijing, how long will it takes?","It depending, if you start from the center of Beijing, it may takes 1.5 hours.",0
What's is the number of the computer users in the world?,About 4.66 billion computer users.,0
"If koala want to  eat leaves, how often does it eat?",Koala eat 5 to 6 times per day.,0
Why should people with pregnancy not use sumac?,"Because sumac works to remove blood stasis, its use in pregnant people can lead to miscarriage or bleeding.",0
"List the time length for the movie Age of Ultron, it is 1 or 2 hours?",It is  2 hours and 21 minutes.,0
List the number of the ears does a rabbit have.,A rabbit has two ears.,0
What type of animal is a cat?,The cat is a species of small carnivorous mammal.,0
Name a country of Australia.,New Zealand.,0
"Which one has less quality, a tiger or an elephant?",A tiger.,0
How many eyes does a monk seal have?,The monk seal has two eyes.,0
What time of year do Vanda orchids bloom in warm tropical climate zones?,It can bloosm at any time of the year under ideal growing conditions.,0
List 3 sports that involve moving your hands and feet.,"Playing badminton, high jumping, swimming.",0
Does the lion run faster then human,"Yes, lion can run about 50 kilometers for one hour, but human just can run about 15 kilometer for one hour",0
When can humans lie or breathe at the same time?,While sleeping.,0
"If I want to get a fish, what should I take?",Fishing net.,0
How to bake fish in an oven?,"1.Make a few cuts in the fish. 2. Stuff with ginger, pour some wine and sprinkle with salt. 3. Marinate for an hour or so to taste. 4. Prepare the garnish, sprinkle with cumin and pepper after the fish has been marinated. 5. Line with tin foil, grease and bake in the oven for 15 minutes. 6. Stir-fry the garnish in a pan. 7. Then pour over the fish and serve.",0
What kind of food does a drone eat?,It eats pollen or nectar.,0
How many legs do humans used for walk?,Two.,0
When can apple trees produce apples?,Usually in autumn,0
Where did Sun Zhongshan live in 1894?,"In Hawaii,US.",0
When did Hopkins named vitamin?,In 1912.,0
What does a pianist take for a swim in the sea?,Swimwear.,0
What kind of habitats does swan like?,"A place with lakes, fresh air and abundant plants.",0
"Which plant do you prefer, hydrangea or horse?",Of course hydrangea.,0
Why do people with strong immune systems not to be prone to infection?,This is because people with a strong immune system are more likely to clear out the virus.,0
List one television drama that was popular in 2010s in China.,Empresses in the Palace.,0
Why adult butterflies emerge from pupas?,The laws of growth.,0
"As a famous chemist, What did Madame Curie find?",She found radium in her chemical experiments.,0
List five non-metallic elements.,"Hydrogen, Helium, Lithium, Beryllium, Boron.",0
What should women pay attention to when breastfeeding their child?,"In terms of diet, women should not eat raw, cold and spicy food, and should not eat greasy and fried food when they breastfeeding their child.",0
How does people feel when having a headache?,People feel dizzy and mostly his body temperature goes up.,0
List a kind of melons that grow on lands.,"Many kinds of melons grow on lands, such as watermelon.",0
When did east and west Germany reunion?,In 1990.,0
How many gizzards does a chicken have?,There are two gizzards.,0
How do Siberian tigers live in Northeast Asia?,"The Siberian tiger lives in the forest, shrub and wild grass. Siberian tigers like to live alone and have no settlement.",0
What's the color of Europeans of hair? Brown or faxen?,"Beside those two, also  blonde or red.",0
How many choices do people have to face to get married?,"People have two choices, to get married or not to get married.",0
How to make cheese out of milk?,"We can use the proteins and fats in milk, and mature it with bacteria or other organisms.",0
Why do we absorb information faster when our brain wave frequency is eight-twelve Hz (Hertz)?,"Because our brains are 'relaxed and active at this time, we are able to absorb information more quickly and effectively.",0
How many wings do eagles have?,Eagles usually have two wings to help them fly in the sky.,0
How many insects with three pairs of legs do you see?,"There are three insects with three pairs of legs including a butterfly, a bee and a beetle.",0
List one method apes turn into humans?,By evolution.,0
How to take a measurement for a elephant's tail?,Using a leather ruler to measure the length of elephant's tail.,0
Do lizards prey on insects to live?,"Yes, because most lizards are carnivorous animals, and insects are their main food.",0
Where can you get oxygen on Earth?,You can get a bottle of oxygen in the hospital.,0
What is the role of the bridge?,"Bridges are specialized man-made structures with load-bearing capacity for use by railways, roads, canals, pipelines, etc. across rivers, valleys or other lines of communication.",0
How can the mom feed her baby?,By the milk.,0
Name a way that I can buy a iPhone 13?,"You can go to an Ipod store, or purchase online.",0
List the time length for a dog to become an adult dog.,"A large dog breed will mature into an adult at about 15 months, while smaller breeds will be puppies for only 9 months.",0
"If I travel to USA, where can I see the White House?",In Washington D.C. of USA.,0
How long ago did us start to using computers?,The first computer was invented by Charles Babbage (1822) but was not built until 1991!,0
Does monkeys live in the national park in China?,"Some national park in China have monkeys, but not all.",0
How long does it take for a caterpillar to become a butterfly?,About 9 months.,0
What color did Tang Dynasty use for paintings?,"Yellow was the major color, also have blue and green.",0
What color are the earphones made by Apple Inc?,They are white.,0
"If a man does proper exercise a day, why he is getting healthier?",Doing exercise can help build a healthy body.,0
How many snout does a rhino have?,A rhino has one snout.,0
Why does a frightened sheep pretend to be dead,because some sheep suffer from congenital myotonia,0
Why can fish breathe in the water?,Because fish has gills.,0
Was the light bulb invented by Edison a great invention?,"Yes, it was invented by Edison in 1879.",0
How long is hurricane season in Texas?,The hurricane season in Texas runs June to November and peaks in early to mid September.,0
"Which fruit has the core, apple or banana?",Apple.,0
Why are the gears round?,"This is because the distance between any point on the circumference of the circle and the centre of the circle is fixed. This is why it is possible to transmit power smoothly, uniformly and continuously during rotation.",0
"If Peking Man got disease like fever, how long will it last? one or two days?","It depending, but most fevers usually go away by themselves after 1 to 3 days. A persistent or recurrent fever may last or keep coming back for up to 14 days.",0
"If I want to know the numbers of the international organizations on the Earth, then what should I do?","You can search online, and there are about eighty-one thousand international organizations on earth.",0
does reefs easy to find in ocean ?,"Yes, and it may cause some accidence",0
"Which is the second letter of the Greek alphabet, beta or alpha?",Beta.,0
Why should we be friendly to others?,Because it can help us make more friends and make the world a little better.,0
Why do durians smell bad?,"Durian has volatile sulfides, which are often described as putrid, rotten egg smell, etc. A group of genes in durian associated with volatile sulfides is highly active when the durian is ripe, giving its strong odor.",0
Who was the person helped Qin Shihuang to design the Terracotta Warriors? Luban or Lisi?,The prime minister Li Si at that time was the designer.,0
Which company is a fortune 500 company in the world? CICI or Wal-Mart?,Wal-Mart.,0
Why can a fish breathe in the ocean?,Because it has gills.,0
Name an animal that can live in the sea.,"There are different types of animals in the sea, such as shark and whale.",0
How many legs does tripod have? three or six?,Tripod have three legs which provides good stability.,0
Why should we avoid being unhealthy?,Because that will make us ill and sick.,0
Why vegetarians also get cancer?,"Vegetarians have fewer cancers, but higher risk of colorectal cancer",0
What kind of meat the ducking is?,Duckling is a duck.,0
"When a trooper raises a grenade, in which direction should he throw it?",He should throw the grenade at where the enemies are.,0
Why does the brake light in the car fail?,The wires had short-circuited and burnt out.,0
What kind of power does a person need to govern a country?,"There are so many, for example, the power to deploy an army.",0
When did Newton prove that white light is a mixture of different colors of light?,Newton proved this theory in 1666.,0
Why glass windows have smooth surfaces?,It is the result of the combined effect of gravity and surface tension of the liquid.,0
List the time leagth for human to hold their breath,The length of time a person can hold their breath voluntarily typically ranges from 30 to 90 seconds,0
Which one is the correct answer regarding the number of the mouths for a man? one or three?,Human only have one.,0
How will they work if we inject vaccines into our bodies?,They will bring antibodies and help with our immune system.,0
How much fat is contained in each 100ml of whole milk?,Whole milk contains only 3.2g of fat per 100ml of milk.,0
Which city is in America. London or Cleveland?,Cleveland.,0
"If we see a terrapin lay eggs in the beach, what should we better do?",We should stay away from it and not interfere too much.,0
"Which one do dogs inhale, oxygen or nuclear energy?",Oxygen. Dogs inhale oxygen and exhale carbon dioxide. They can't inhale nuclear energy.,0
Why does bust size affect female beauty?,"Because the breast size has to match the figure, too big or too small will affect the aesthetics.",0
What kind of stone is the jade bangle?,Jade Bangle is a kind of stone named jade.,0
What kind of tools do people use to download softwares?,Use a computer or a phone with Internet.,0
Where do swots buy books?,They can go to bookstores to buy different books.,0
How many fins does a whale have?,they usually born with five fins.,0
Is TV biger than laptop?,Yes.,0
Why stone will not get any illnesses?,Because stone is lifeless.,0
Where do bird's wings grow?,On both sides of its body,0
How can the announcement become a public message?,Announcement can make everyone heard of the news.,0
Why is the grass green?,"Because in its leaves, there is a lot of chlorophyll.",0
How many lives do human have?,Humen have only one life.,0
How often does a pilot fly a plane?,Airline pilots fly an average of 75 hours per month,0
How many brains does a cat have?,Only one.,0
How can people buy product?,People can buy product with money.,0
Name a healing method that can treat the tired people.,Massage and meditation are two useful healing methods that can treat the tired people.,0
What type of icon do you use?,Steam Iron is the one in my family.,0
Which adjunct of the TV is the monitor?,In the screen.,0
What are the atoms of a water molecule?,A water molecule is made up of two hydrogen atoms and one oxygen atom.,0
How many hands does a monkey have?,A monkey has two hands.,0
How long can birds fly?,"It depends on the bird! Ostriches can闂佺偨鍎查悰 even fly. Kakapos only clumsily glide. At the other extreme, large birds like albatrosses use updraughts of wind to soar for hours or days without much more effort than just sitting.",0
How many coats of fur does cats have to keep warm?,"Cats may have from one to three types of hair in their coats, referenced sometimes as ""double coat,"" or ""triple coat,"" plus their distinctive whiskers, which are also hairs.",0
How many babies does a solitary dolphin give birth to at a time?,Usually one or two.,0
Why don't you see swell in small ponds during high winds?,"Because the small ponds are smaller, the waves will be smaller too.",0
Why can cactus grow in the desert?,"Because the cactus has a well-developed root system, it can reach the deep layers of the soil and obtain water.",0
Why can disease make people feel uncomfortable?,Because it will attack people's immune system.,0
How does raw sesame turn into sesame oil?,By pouring raw sesame into the oil press.,0
Why do bears hibernate in winter?,Usually because there isn't enough food or proper temperature for bears. So they eat a lot of food and find a proper cave to hibernate in winter.,0
What kind of animals does the eland belong to?,It belongs to Bovidae.,0
Why does concentrated sulphuric acid dehydrate sucrose?,"Because sucrose is an organic substance containing the elements hydrogen and oxygen, it is dehydrated to produce black charcoal, a process known as charring.",0
Which one is farm animal? Sheep or dolpin?,Sheep.,0
Which is sense organ? Hand or stomach?,Hand.,0
"If a student want to have basic education, how many years will it takes?","In China, nine years of education is compulsory.",0
Where is Florida located in United State?,Florida is a state located in the southeastern region of the United States.,0
How does a ship navigate the sea?,It depends on the buoyancy of water.,0
Where can we fix our cellphone in 2000?,We can turn to the manufacturer for help.,0
How to have a picnic in the park?,Take some food to the park and then find a place to eat.,0
Please introduce how can cardinals fly?,Cardinals flap their wings to fly.,0
List when is the best time for a student to make great progress in English study?,"Learning is most effective when the brain is in acquisition mode, generally between 10:00 am to 2:00 p.m. and then again from 4:00 p.m. to 10:00 p.m.",0
How long does a woman pregnant?,About 10 months.,0
When did singer Yao Beina die of breast cancer?,Yao Beina died of breast cancer in 2015.,0
list two kind of animals can swim in the river?,fish and human,0
What type of transport can take you to the Moon?,Spacecraft or rocket.,0
How do humane traps trap a mouse?,"All humane mouse traps operate on a 'relocation闂 or 'Catch & Release闂 strategy, which means that once you complete the hard part (the catch) you then release the animal back into the wild.",0
Which is solid object? Water or diamond?,Diamond.,0
What kind of general is the leader?,General is generally a senior military general to lead soldiers.,0
How does water extinguish fires?,"Water in contact with fire absorbs a large amount of heat from the fire, causing the temperature of the burning material to drop below the ignition point and extinguish it.",0
Who makes loaf from wheat?,Bakers.,0
Do people eat vegetable because it comes with mutiple nutrition,Yes,0
Why can a cockcomb be eaten?,Because cockscomb is rich in nutrients and can be cooked in various ways.,0
Name a way that japanese macaque can use their legs to walk?,"Like human, the leg that leaves the ground swings forward from the hip.",0
How long does it take to make blood by our own body?,Your body will replace the blood volume (plasma) within 48 hours. It will take four to eight weeks for your body to completely replace the red blood cells you donated.,0
"Which one does the coco release, light or smell?",Coco can release smell.,0
why we are getting poor after we lost our job,Because we can't get money from the job,0
Can you tell me the shape of the clock?,It's circle,0
How do we make snowmen in winter?,"When the snow is thick enough,you can do it!",0
Is medicine store the right place to get some isopropyl alcohol?,"Yes, you can get them from medicine store.",0
Why do people like the iguana with a tail?,"I don't know, it depends on people's taste, maybe some of people will like it.",0
How many hands does a boy have?,Two.,0
What type of animals are herbivores?,"A lot of animals are herbivores, such as hummingbird. It usually feed on the nectar of these plants.",0
What kind of creatures are mushrooms?,Fungi.,0
Do people often watch TV programs on computers?,"Yes, it's quiet convenient to watch TV through Internet by computers.",0
Name two types of vegetables people can eat.,Potato and cucumber,0
"In the Monkey King Story, how did Monkey king fight with Ox Monster?",By wisdom and magic power.,0
Does the tendon in human's arthritis connect muscle?,"Yes, tendons are fibrous cords of connective tissue which attach muscle to bone.",0
How can we avoid cancer?,"Stay healthy, eat more vegetables.",0
What is considered a good mood?,"Maybe a calm, peaceful state of mind.",0
How do you build strength when you're low in it?,Go to rest and eat something.,0
What's the belief of Christians?,They believe in Jesus Christ.,0
Where does shark grow? in ocean or desert?,Shark grow in ocean.,0
What's the land area of China in Asia?,About 9.6 million square kilometers.,0
Do clippers move faster than canoes in the water?,"Yes, because clippers are usually equipped with strong engines.",0
How do I park my bicycle in the parking lot?,"Maybe you can park it beside your car, you should ask the parking staff.",0
When do people need to wear coat?,When people feel cold.,0
does carbon nanotube fiber tensile stress is higher than diamond?,Because carbon nanotube fiber is the material with the highest tensile stress because of its low density and stable structure.,0
When was the oldest modern European founded city formed in Africa,"The oldest modern European founded city on the African continent is Cape Town, which was founded by the Dutch East India Company in 1652.",0
Which energy could the large turbines use to generate power solar energy or wind?,Both.,0
Look!How many dogs are running over there?,Five.,0
Why are all mirrors reflective?,The mirror is able to reflect the sun's rays completely due to its smooth surface and the coating on the back of the mirror.,0
How to help a dog with no eyes to walk?,We can lead the dog on a leash.,0
How does anger make us violent and irritable?,"Anger is an emotional state that varies from mild irritation to intense anger, when it occurs, we may feel different state of anger.",0
What foods belong to agricultural products?,Rice and vegetables.,0
Where can the water flow into the sea?,At the end of the river.,0
What kind of facts can be believed by everyone?,Objective facts are believed by everyone.,0
What kind of music do you like to hear?,Rock.,0
How much cloth does it take to make a T-shirt?,About six point five feet of cloth.,0
Where should I wear my apple watch? on my wrist or under armpit?,On your left or right wrist.,0
What kind of vegetable can be made into soybean milk?,Red bean.,0
"If we want to extract thulium from mineral, what should we do?",We can smelt or refine the mineral to extract thulium.,0
Why can human think?,Because human has brains for thinking.,0
How many students are there in Zhengzhou University.,Tens of thousands of.,0
"If I want to watch television at 23:00, what should I do?",Wait until 23:00 or set an alarm.,0
Why onstruction workers must work with their safety caps on?,Safety caps are worn on construction sites mainly to prevent injuries from falling objects or other collision injuries.,0
List one animal that can swim.,Fish.,0
How can gas burn?,Gas can burn with oxygen.,0
How can a student deal with math problem?,The student can ask advice from teacher or parents.,0
Are human's toes more than cats'?,"Yes, human have five toes of one hand, while cats only have 4 toes of one hand.",0
Why does Beggar have no job,maybe because they have no any skill to find a job,0
What kind of butterfly can fly?,All kinds of butterflies can fly.,0
When will my brother become an adult?,"When he is 18 years old, he becomes an adult.",0
Does the driver work on the sunday of each week,"it's depends, drivers usually work at weekends.",0
Which substance do you use to make your clothes foam? Laundry detergent or sulphuric acid?,Laundry detergent creates a lot of suds in the wash.,0
What kind of metals can flow in the room temperature?,Mercury can flow in the room temperature.,0
Name a finding published by newton.,Newton's first law.,0
Why is it that money can't buy any product?,"Because the sale is between two parties, as soon as one of them does not agree, the sale ceases to exist.",0
What kind of plants does the eggplant belong to?,The eggplant belongs to the Solanum genus.,0
"Which animal do you prefer, hyena or vine?",I prefer hyena.,0
What kind of animals can creep?,Earthworms are one of the animals that can creep.,0
When and where did Gyorgy Jendrassik invent the first propeller engine?,He invented it in 1937 in Hungary.,0
Why are all businesses taxed?,"This is because under our law, it is everyone's responsibility to pay taxes according to the law.",0
Name the number of the penises a man have?,A man has only one penis.,0
Name a reason why does burning require oxygen.,Because the essence of combustion is the chemical reaction of combustibles with oxygen,0
What kind of plant can photosynthesize?,"Most plants will do, as long as they contain chlorophyll.",0
How do we adapt to life on campus?,Try to make some new friends.,0
What color are the feathers of a pigeon?,"Most pigeons have white feathers, but some may have grey and black feathers.",0
how can we get milk from cows?,Cows are mammals that produce milk during pregnancy,0
What kind of stones can crush eggs?,Cobblestone can easily crush egg.,0
is amniotic liquid because the baby need to be fixed,"In the early stages of pregnancy, the source of amniotic fluid is mainly the dialysate of maternal serum passing through the fetal membranes into the amniotic cavity, and after the middle of pregnancy, fetal urine becomes the main source of amniotic fluid",0
When is the boiling point of water?,When temperature reach to 100 celsius.,0
Which device can be used to take photograph? Microwave or smartphone?,Smartphone.,0
How can human express annoyance?,Complaining about everything or having no interest in anything.,0
How to make bread with flour?,Mix the flour with water and yeast.,0
Where can people see the lighthouse in a country?,On the coast or on a small island.,0
Are the calories in water higher than those in beef?,"No, because calroies in beef are much more than those in water.",0
Why don't sheep eat meat?,"Because sheep's intestines can't digest meat, sheep is herbivore",0
"If I want to dance on a stage, what should I do?",You should practise more.,0
Why people eat vegetable for keeping healthy,because vegetable can  provide many kind of nutrition,0
"Which one flies higher, a bee or a plane?",A plane.,0
How many legs does a woman have?,Two.,0
Are medicines bitter?,"Some medicines are bitter, but some are not. Sometimes children's medicines taste sweet.",0
Does a caterpillar a plant that has two eyes  to look for food ?,"No, they have six pairs of very simple eyes, called cellist, but their vision is poor, not able to look for food by using eyes.",0
Where can I see female animals?,In the zoo or in the Natural Reserves.,0
