question,answer,label
"Which city is in America, London or Sydney?","London is in England and Sydney is in Australia, neither of which is in the United States.",1
"If we see a terrapin lay eggs in the desert, what should we better do?","Tortoises usually lay their eggs on sand, not in the desert.",1
"Which one do dogs exhale, oxygen or nuclear energy?","Dogs breathe out carbon dioxide, neither oxygen nor nuclear energy.",1
Why is the larger the breast size the better?,No studies show that bigger breasts are better.,1
What kind of stone is the wax figures?,Waxworks are statues made of paraffin wax and have nothing to do with stone.,1
What kind of tools does Hitler use to download software?,Hitler lived without software.,1
Where do books buy swots?,"Books are for people to read, and swot is a method of analysis.",1
How many fins does a cow have?,Only fish have fins.,1
Is TV's nose smaller than laptop's?,TVS and laptops are artificial. They don't have a nose.,1
Why human will not get any illnesses?,It's genetically determined that all human should get illness.,1
Where do deer's wings grow?,Deer are not birds and have no wings.,1
