question,answer,label
How can a book express annoyance?,"Books can't express worries because they can't think, but people who write books can express worries with books",1
How to make bread with stone?,Bread is usually made from wheat-flour闂佹寧绋戦惀鐣 stone. Stone can't be eaten so you can't make bread with stone.,1
Where can people see the lighthouse in the library?,The lighthouse is on the coastline and at sea rather than in the library.,1
Why are the calories in water higher than those in beef?,Water is an inorganic substance. It has zero calories.,1
Why don't carnivore eat meat?,Carnivore only eats meats.,1
If I want to swim on a stage. What should I do?,"You can swim in a pool or in the ocean, not on a stage.",1
Why people eat toxic food for keeping healthy,Toxic food is harmful to human body.,1
"Which one flies higher, a squirrel or a fox?",Neither the pine nor the fox can fly.,1
How many branches does a woman have?,Humans are not plants; plants are the ones with branches.,1
Are medicines the sweetest among all candies?,Medicine is not a kind of candy.,1
Does a caterpillar a plant that has two eyes  to look for food ?,"A caterpillar is an insect, not a plant.",1
Where can I see the female stones?,"There is no sex in stones, stones are not animals",1
Does crocodile use their hands to eat fruit since it belongs to birds ?,"Crocodiles are reptiles, carnivores and do not eat fruit.",1
How to ride mouse to school?,The mouse is too small to ride it. You can ride a bike to school instead of riding a mouse.,1
Name three kinds of meat that seaweed eats.,Seaweed is a plant and does not eat meat.,1
What kind of cats can fly?,"A cat is a mammal, not a bird, and can't fly.",1
How can a person become a loudspeaker?,"People can't turn into a loudspeaker, loudspeakers are machines",1
