question,answer,label
How many times a year can a sailor see a mermaid,"Mermaids actually only exist in legends, and no one has ever seen a real mermaid in reality.",1
What should we take when we go fishing in shopping malls?,Shopping centers usually don't have fishing grounds. We can fish by the river and the sea.,1
Why are most of windows made of diamonds?,Most windows are made of glass.,1
Why are adults not allowed in internet cafes?,Those who are not allowed to enter the Internet cafe are juveniles.,1
"If I want to cook rice with a mop, when should I start to prepare?","Rice is cooked in ricecooker or pot, not mop.",1
"Which explosive is more powerful in the 1600s, the grenades or black powders?","In the seventeenth century, grenades had not been invented, and the question was wrong.",1
